{
  "$schema": "pools.schema.json",
  "seasonStartDate": "2025-05-24",
  "seasonEndDate": "2025-09-01",
  "caPoolDirectoryUrl": "https://experience.arcgis.com/experience/ac58c73ab9bd4640a880c8ddf46bf198",
  "caPoolGuideUrl": "https://columbiaassociation.org/swim/your-guide-to-cas-2025-pool-season/",
  "pools": [
    {
      "id": "bwp",
      "name": "Bryant Woods",
      "caUrl": "https://columbiaassociation.org/sports-recreation/pools/pool-locations/bryant-woods-pool-bw/",
      "location": {
        "street": "10451 Green Mountain Cir",
        "city": "Columbia",
        "state": "MD",
        "zip": "21044",
        "lat": 39.2218394,
        "lng": -76.8696213,
        "mapsQuery": "Bryant Woods Pool Columbia MD",
        "googleMapsUrl": "https://maps.app.goo.gl/JVc94GRVWrKKmKgW7"
      },
      "phone": "410-730-5326",
      "features": [
        "hot tub",
        "lap",
        "pool lift",
        "shade",
        "wading",
        "wifi"
      ],
      "scheduleUrl": "https://www.columbiaassociation.org/wp-content/uploads/Bryant_Woods.pdf",
      "schedules": [
        {
          "startDate": "2025-05-24",
          "endDate": "2025-05-26",
          "hours": [
            {
              "weekDays": [
                "Sat",
                "Sun",
                "Mon"
              ],
              "startTime": "12:00pm",
              "endTime": "7:00pm",
              "types": [
                "Laps",
                "Rec Swim"
              ]
            }
          ]
        },
        {
          "startDate": "2025-05-27",
          "endDate": "2025-06-18",
          "hours": [
            {
              "weekDays": [
                "Mon",
                "Wed",
                "Thu",
                "Fri"
              ],
              "startTime": "4:00pm",
              "endTime": "7:00pm",
              "types": [
                "Laps",
                "Rec Swim"
              ]
            },
            {
              "weekDays": [
                "Tue"
              ],
              "types": [
                "Closed to Public"
              ]
            },
            {
              "weekDays": [
                "Sat",
                "Sun"
              ],
              "startTime": "12:00pm",
              "endTime": "7:00pm",
              "types": [
                "Laps",
                "Rec Swim"
              ]
            }
          ]
        },
        {
          "startDate": "2025-06-19",
          "endDate": "2025-08-10",
          "hours": [
            {
              "weekDays": [
                "Mon",
                "Wed",
                "Thu",
                "Fri"
              ],
              "startTime": "10:45am",
              "endTime": "12:00pm",
              "types": [
                "Aqua Fitness"
              ]
            },
            {
              "weekDays": [
                "Mon",
                "Wed",
                "Thu",
                "Fri"
              ],
              "startTime": "12:00pm",
              "endTime": "5:45pm",
              "types": [
                "Laps",
                "Rec Swim"
              ]
            },
            {
              "weekDays": [
                "Mon",
                "Wed",
                "Thu"
              ],
              "startTime": "5:45pm",
              "endTime": "8:00pm",
              "types": [
                "Laps"
              ]
            },
            {
              "weekDays": [
                "Tue"
              ],
              "startTime": "10:45am",
              "endTime": "12:00pm",
              "types": [
                "Aqua Fitness"
              ]
            },
            {
              "weekDays": [
                "Tue"
              ],
              "startTime": "12:00pm",
              "endTime": "8:00pm",
              "types": [
                "Closed to Public"
              ]
            },
            {
              "weekDays": [
                "Fri"
              ],
              "startTime": "5:45pm",
              "endTime": "7:00pm",
              "types": [
                "Laps"
              ]
            },
            {
              "weekDays": [
                "Fri"
              ],
              "startTime": "7:00pm",
              "endTime": "10:00pm",
              "types": [
                "Adult Swim"
              ]
            },
            {
              "weekDays": [
                "Sat"
              ],
              "startTime": "9:30am",
              "endTime": "10:25am",
              "types": [
                "Aqua Fitness"
              ]
            },
            {
              "weekDays": [
                "Sat"
              ],
              "startTime": "10:30am",
              "endTime": "7:00pm",
              "types": [
                "Laps",
                "Rec Swim"
              ]
            },
            {
              "weekDays": [
                "Sun"
              ],
              "startTime": "11:00am",
              "endTime": "7:00pm",
              "types": [
                "Laps",
                "Rec Swim"
              ]
            }
          ]
        },
        {
          "startDate": "2025-08-11",
          "endDate": "2025-08-24",
          "hours": [
            {
              "weekDays": [
                "Mon",
                "Wed",
                "Thu",
                "Fri"
              ],
              "startTime": "12:00pm",
              "endTime": "4:30pm",
              "types": [
                "Laps",
                "Rec Swim"
              ]
            },
            {
              "weekDays": [
                "Mon",
                "Wed",
                "Thu",
                "Fri"
              ],
              "startTime": "4:30pm",
              "endTime": "7:00pm",
              "types": [
                "Laps"
              ]
            },
            {
              "weekDays": [
                "Tue"
              ],
              "types": [
                "Closed to Public"
              ]
            },
            {
              "weekDays": [
                "Sat",
                "Sun"
              ],
              "startTime": "12:00pm",
              "endTime": "7:00pm",
              "types": [
                "Laps",
                "Rec Swim"
              ]
            }
          ]
        },
        {
          "startDate": "2025-08-25",
          "endDate": "2025-08-31",
          "hours": [
            {
              "weekDays": [
                "Mon",
                "Tue",
                "Wed",
                "Thu",
                "Fri"
              ],
              "types": [
                "Closed to Public"
              ]
            },
            {
              "weekDays": [
                "Sat",
                "Sun"
              ],
              "startTime": "12:00pm",
              "endTime": "6:00pm",
              "types": [
                "Laps",
                "Rec Swim"
              ]
            }
          ]
        },
        {
          "startDate": "2025-09-01",
          "endDate": "2025-09-01",
          "hours": [
            {
              "weekDays": [
                "Mon"
              ],
              "startTime": "12:00pm",
              "endTime": "6:00pm",
              "types": [
                "Laps",
                "Rec Swim"
              ]
            }
          ]
        }
      ]
    },
    {
      "id": "cfp",
      "name": "Clary's Forest",
      "caUrl": "https://columbiaassociation.org/sports-recreation/pools/pool-locations/clarys-forest-cf-pool/",
      "location": {
        "street": "11615 Little Patuxent Pkwy",
        "city": "Columbia",
        "state": "MD",
        "zip": "21044",
        "lat": 39.194296,
        "lng": -76.8728068,
        "mapsQuery": "Clary's Forest Pool Columbia MD",
        "googleMapsUrl": "https://maps.app.goo.gl/USbbviedhzT6mXAc7"
      },
      "phone": "410-964-0805",
      "features": [
        "beach entry",
        "dive",
        "hot tub",
        "lap",
        "play features",
        "pool lift",
        "shade",
        "volleyball",
        "wading",
        "wifi"
      ],
      "scheduleUrl": "https://www.columbiaassociation.org/wp-content/uploads/Clarys_Forest.pdf",
      "schedules": []
    },
    {
      "id": "ccp",
      "name": "Clemens Crossing",
      "caUrl": "https://columbiaassociation.org/sports-recreation/pools/pool-locations/clemens-crossing-cc-pool/",
      "location": {
        "street": "6400 Martin Road",
        "city": "Columbia",
        "state": "MD",
        "zip": "21044",
        "lat": 39.194296,
        "lng": -76.8728068,
        "mapsQuery": "Clemens Crossing Pool Columbia MD",
        "googleMapsUrl": "https://maps.app.goo.gl/nDhXsSz8vgU3NLWh6"
      },
      "phone": "410-997-4214",      
      "features": [
        "dive",
        "lap",
        "pool lift",
        "shade",
        "slide",
        "soccer",
        "softball",
        "wading",
        "wifi"
      ],
      "scheduleUrl": "https://www.columbiaassociation.org/wp-content/uploads/Clemens_Crossing.pdf",
      "schedules": []
    },
    {
      "id": "dgp",
      "name": "Dasher Green",
      "caUrl": "https://columbiaassociation.org/sports-recreation/pools/pool-locations/dasher-green-dg-pool/",
      "location": {
        "street": "6805 Cradlerock Way",
        "city": "Columbia",
        "state": "MD",
        "zip": "21045",
        "lat": 39.1939232,
        "lng": -76.8457802,
        "mapsQuery": "Dasher Green Pool Columbia MD",
        "googleMapsUrl": "https://maps.app.goo.gl/ccMhQkE8MaApGSTP6"
      },
      "phone": "410-715-3194",
      "features": [
        "bathhouse",
        "cornhole",
        "hot tub",
        "lap",
        "shade",
        "slide",
        "wading",
        "wifi"
      ],
      "scheduleUrl": "https://www.columbiaassociation.org/wp-content/uploads/Dasher_Green.pdf",